CREATE TABLE t1 (c1 INT, c2 VARCHAR(100));
INSERT INTO t1 VALUES (1, '{"vector": [1.1, 2.2, 3.3]}');
INSERT INTO t1 VALUES (2, '{"vector": [2.2, 3.3, 4.4]}');
INSERT INTO t1 VALUES (3, '{"vector": [3.3, 4.4, 5.5]}');
SELECT myvector_index_build('idx_binlog', 't1', 'c2', 'vector');
myvector_index_build('idx_binlog', 't1', 'c2', 'vector')
Index created
INSERT INTO t1 VALUES (4, '{"vector": [4.4, 5.5, 6.6]}');
UPDATE t1 SET c2 = '{"vector": [9.9, 9.9, 9.9]}' WHERE c1 = 4;
SELECT c1 FROM t1 WHERE myvector_is_ann('idx_binlog', '{"vector": [9.9, 9.9, 9.9]}', 1);
c1
4
DELETE FROM t1 WHERE c1 = 4;
SELECT myvector_index_drop('idx_binlog');
myvector_index_drop('idx_binlog')
Index dropped
DROP TABLE t1;
